a3-ivp-m-668,Error,A3,I - UDS Initial Visit (new participants),KID15ETSEC,Missingness,KID15ETSEC conditionally present,if Q3. KIDS ( How many biological children?) is (>14 and <=15) and Q3o3. KID15ETPR (Child 15 primary dx) is in (01-12) then Q3o4. KID15ETSEC (Child 15 secondary dx) must be present,,"KIDS, KID15ETPR, KID15ETSEC"
a3-ivp-m-669,Error,A3,I - UDS Initial Visit (new participants),KID15ETSEC,Missingness,KID15ETSEC conditionally blank,"if (Q3. KIDS ( How many biological children?) is <15, or (Q3o3. KID15ETPR (Child 15 primary dx) is 00 (No neurological/psychological dx) or 99 (unknown)) then Q3o4. KID15ETSEC (Child 15 secondary dx) must be blank",,"KIDS, KID15ETPR, KID15ETSEC"
a3-ivp-m-671,Error,A3,I - UDS Initial Visit (new participants),KID15MEVAL,Missingness,KID15MEVAL conditionally present,if Q3. KIDS ( How many biological children?) is (>14 and <=15) and Q3o3. KID15ETPR (Child 15 primary dx) is in (01-12) then Q3o5. KID15MEVAL (Child 15 method of evaluation) must be present,,"KIDS, KID15ETPR, KID15MEVAL"
a3-ivp-m-672,Error,A3,I - UDS Initial Visit (new participants),KID15MEVAL,Missingness,KID15MEVAL conditionally blank,"if (Q3. KIDS ( How many biological children?) is <15, or (Q3o3. KID15ETPR (Child 15 primary dx) is 00 (No neurological/psychological dx) or 99 (unknown)) then Q3o5. KID15MEVAL (Child 15 method of evaluation) must be blank",,"KIDS, KID15ETPR, KID15MEVAL"
a3-ivp-m-674,Error,A3,I - UDS Initial Visit (new participants),KID15AGO,Missingness,KID15AGO conditionally present,if (Q3. KIDS ( How many biological children?) is (<14 and <=15) and Q3o3. KID15ETPR (Child 15 primary dx) is in (01-12) then Q3o6. KID15AGO (Child 15 age of onset of primary dx) must be present,,"KIDS, KID15ETPR, KID15AGO"
a3-ivp-m-675,Error,A3,I - UDS Initial Visit (new participants),KID15AGO,Missingness,KID15AGO conditionally blank,"if (Q3. KIDS ( How many biological children?) is <15, or (Q3o3. KID15ETPR (Child 15 primary dx) is 00 (No neurological/psychological dx) or 99 (unknown)) then Q3o6. KID15AGO (Child 15 age of onset of primary dx) must be blank",,"KIDS, KID15ETPR, KID15AGO"
a3-ivp-p-1001,Error,A3,I - UDS Initial Visit (new participants),MOMAGEO,Plausibility,MOMAGEO cannot be > than MOMDAGE,"If Q1a6. MOMAGEO (Mom age of onset of primary dx) is in (0-110) and Q1a2. MOMDAGE (Mom death age) is in (0-110), then Q1a6. MOMAGEO (Mom age of onset of primary dx) must be <=Q1a2. MOMDAGE (Mom death age)",,"MOMAGEO, MOMDAGE"
a3-ivp-p-1002,Error,A3,I - UDS Initial Visit (new participants),DADAGEO,Plausibility,DADAGEO cannot be > than DADDAGE,"If Q1b6. DADAGEO (Dad age of onset of primary dx) is in (0-110) and Q1b2. DADDAGE (Dad death age) is in (0-110), then Q1b6. DADAGEO (Dad age of onset of primary dx) must be <=Q1b2. DADDAGE (Dad death age)",,"DADAGEO, DADDAGE"
a3-ivp-p-1003,Error,A3,I - UDS Initial Visit (new participants),SIB1AGO,Plausibility,SIB1AGO cannot be > than SIB1AGD,"If Q2a6. SIB1AGO (Sibling 1 age of onset of primary dx) is in (0-110) and Q2a2. SIB1AGD (Sibling 1 death age) is in (0-110), then Q2a6. SIB1AGO (Sibling 1 age of onset of primary dx) must be <= Q2a2. SIB1AGD (Sibling 1 death age)",,"SIB1AGO, SIB1AGD"
a3-ivp-p-1004,Error,A3,I - UDS Initial Visit (new participants),SIB2AGO,Plausibility,SIB2AGO cannot be > than SIB2AGD,"If Q2b6. SIB2AGO (Sibling 2 age of onset of primary dx) is in (0-110) and Q2b2. SIB2AGD (Sibling 2 death age) is in (0-110), then Q2b6. SIB2AGO (Sibling 2 age of onset of primary dx) must be <= Q2b2. SIB2AGD (Sibling 2 death age)",,"SIB2AGO, SIB2AGD"
a3-ivp-p-1005,Error,A3,I - UDS Initial Visit (new participants),SIB3AGO,Plausibility,SIB3AGO cannot be > than SIB3AGD,"If Q2c6. SIB3AGO (Sibling 3 age of onset of primary dx) is in (0-110) and Q2c2. SIB3AGD (Sibling 3 death age) is in (0-110), then Q2c6. SIB3AGO (Sibling 3 age of onset of primary dx) must be <= Q2c2. SIB3AGD (Sibling 3 death age)",,"SIB3AGO, SIB3AGD"
a3-ivp-p-1006,Error,A3,I - UDS Initial Visit (new participants),SIB4AGO,Plausibility,SIB4AGO cannot be > than SIB4AGD,"If Q2d6. SIB4AGO (Sibling 4 age of onset of primary dx) is in (0-110) and Q2d2. SIB4AGD (Sibling 4 death age) is in (0-110), then Q2d6. SIB4AGO (Sibling 4 age of onset of primary dx) must be <= Q2d2. SIB4AGD (Sibling 4 death age)",,"SIB4AGO, SIB4AGD"
a3-ivp-p-1007,Error,A3,I - UDS Initial Visit (new participants),SIB5AGO,Plausibility,SIB5AGO cannot be > than SIB5AGD,"If Q2e6. SIB5AGO (Sibling 5 age of onset of primary dx) is in (0-110) and Q2e2. SIB5AGD (Sibling 5 death age) is in (0-110), then Q2e6. SIB5AGO (Sibling 5 age of onset of primary dx) must be <= Q2e2. SIB5AGD (Sibling 5 death age)",,"SIB5AGO, SIB5AGD"
a3-ivp-p-1008,Error,A3,I - UDS Initial Visit (new participants),SIB6AGO,Plausibility,SIB6AGO cannot be > than SIB6AGD,"If Q2f6. SIB6AGO (Sibling 6 age of onset of primary dx) is in (0-110) and Q2f2. SIB6AGD (Sibling 6 death age) is in (0-110), then Q2f6. SIB6AGO (Sibling 6 age of onset of primary dx) must be <= Q2f2. SIB6AGD (Sibling 6 death age)",,"SIB6AGO, SIB6AGD"
a3-ivp-p-1009,Error,A3,I - UDS Initial Visit (new participants),SIB7AGO,Plausibility,SIB7AGO cannot be > than SIB7AGD,"If Q2g6. SIB7AGO (Sibling 7 age of onset of primary dx) is in (0-110) and Q2g2. SIB7AGD (Sibling 7 death age) is in (0-110), then Q2g6. SIB7AGO (Sibling 7 age of onset of primary dx) must be <= Q2g2. SIB7AGD (Sibling 7 death age)",,"SIB7AGO, SIB7AGD"
a3-ivp-p-1010,Error,A3,I - UDS Initial Visit (new participants),SIB8AGO,Plausibility,SIB8AGO cannot be > than SIB8AGD,"If Q2h6. SIB8AGO (Sibling 8 age of onset of primary dx) is in (0-110) and Q2h2. SIB8AGD (Sibling 8 death age) is in (0-110), then Q2h6. SIB8AGO (Sibling 8 age of onset of primary dx) must be <= Q2h2. SIB8AGD (Sibling 8 death age)",,"SIB8AGO, SIB8AGD"
a3-ivp-p-1011,Error,A3,I - UDS Initial Visit (new participants),SIB9AGO,Plausibility,SIB9AGO cannot be > than SIB9AGD,"If Q2i6. SIB9AGO (Sibling 9 age of onset of primary dx) is in (0-110) and Q2i2. SIB9AGD (Sibling 9 death age) is in (0-110), then Q2i6. SIB9AGO (Sibling 9 age of onset of primary dx) must be <= Q2i2. SIB9AGD (Sibling 9 death age)",,"SIB9AGO, SIB9AGD"
a3-ivp-p-1012,Error,A3,I - UDS Initial Visit (new participants),SIB10AGO,Plausibility,SIB10AGO cannot be > than SIB10AGD,"If Q2j6. SIB10AGO (Sibling 10 age of onset of primary dx) is in (0-110) and Q2j2. SIB10AGD (Sibling 10 death age) is in (0-110), then Q2j6. SIB10AGO (Sibling 10 age of onset of primary dx) must be <= Q2j2. SIB10AGD (Sibling 10 death age)",,"SIB10AGO, SIB10AGD"
a3-ivp-p-1013,Error,A3,I - UDS Initial Visit (new participants),SIB11AGO,Plausibility,SIB11AGO cannot be > than SIB11AGD,"If Q2k6. SIB11AGO (Sibling 11 age of onset of primary dx) is in (0-110) and Q2k2. SIB11AGD (Sibling 11 death age) is in (0-110), then Q2k6. SIB11AGO (Sibling 11 age of onset of primary dx) must be <= Q2k2. SIB11AGD (Sibling 11 death age)",,"SIB11AGO, SIB11AGD"
a3-ivp-p-1014,Error,A3,I - UDS Initial Visit (new participants),SIB12AGO,Plausibility,SIB12AGO cannot be > than SIB12AGD,"If Q2l6. SIB12AGO (Sibling 12 age of onset of primary dx) is in (0-110) and Q2l2. SIB12AGD (Sibling 12 death age) is in (0-110), then Q2l6. SIB12AGO (Sibling 12 age of onset of primary dx) must be <= Q2l2. SIB12AGD (Sibling 12 death age)",,"SIB12AGO, SIB12AGD"
a3-ivp-p-1015,Error,A3,I - UDS Initial Visit (new participants),SIB13AGO,Plausibility,SIB13AGO cannot be > than SIB13AGD,"If Q2m6. SIB13AGO (Sibling 13 age of onset of primary dx) is in (0-110) and Q2m2. SIB13AGD (Sibling 13 death age) is in (0-110), then Q2m6. SIB13AGO (Sibling 13 age of onset of primary dx) must be <= Q2m2. SIB13AGD (Sibling 13 death age)",,"SIB13AGO, SIB13AGD"
a3-ivp-p-1016,Error,A3,I - UDS Initial Visit (new participants),SIB14AGO,Plausibility,SIB14AGO cannot be > than SIB14AGD,"If Q2n6. SIB14AGO (Sibling 14 age of onset of primary dx) is in (0-110) and Q2n2. SIB14AGD (Sibling 14 death age) is in (0-110), then Q2n6. SIB14AGO (Sibling 14 age of onset of primary dx) must be <= Q2n2. SIB14AGD (Sibling 14 death age)",,"SIB14AGO, SIB14AGD"
a3-ivp-p-1017,Error,A3,I - UDS Initial Visit (new participants),SIB15AGO,Plausibility,SIB15AGO cannot be > than SIB15AGD,"If Q2o6. SIB15AGO (Sibling 15 age of onset of primary dx) is in (0-110) and Q2o2. SIB15AGD (Sibling 15 death age) is in (0-110), then Q2o6. SIB15AGO (Sibling 15 age of onset of primary dx) must be <= Q2o2. SIB15AGD (Sibling 15 death age)",,"SIB15AGO, SIB15AGD"
a3-ivp-p-1018,Error,A3,I - UDS Initial Visit (new participants),SIB16AGO,Plausibility,SIB16AGO cannot be > than SIB16AGD,"If Q2p6. SIB16AGO (Sibling 16 age of onset of primary dx) is in (0-110) and Q2p2. SIB16AGD (Sibling 16 death age) is in (0-110), then Q2p6. SIB16AGO (Sibling 16 age of onset of primary dx) must be <= Q2p2. SIB16AGD (Sibling 16 death age)",,"SIB16AGO, SIB16AGD"
a3-ivp-p-1019,Error,A3,I - UDS Initial Visit (new participants),SIB17AGO,Plausibility,SIB17AGO cannot be > than SIB17AGD,"If Q2q6. SIB17AGO (Sibling 17 age of onset of primary dx) is in (0-110) and Q2q2. SIB17AGD (Sibling 17 death age) is in (0-110), then Q2q6. SIB17AGO (Sibling 17 age of onset of primary dx) must be <= Q2q2. SIB17AGD (Sibling 17 death age)",,"SIB17AGO, SIB17AGD"
a3-ivp-p-1020,Error,A3,I - UDS Initial Visit (new participants),SIB18AGO,Plausibility,SIB18AGO cannot be > than SIB18AGD,"If Q2r6. SIB18AGO (Sibling 18 age of onset of primary dx) is in (0-110) and Q2r2. SIB18AGD (Sibling 18 death age) is in (0-110), then Q2r6. SIB18AGO (Sibling 18 age of onset of primary dx) must be <= Q2r2. SIB18AGD (Sibling 18 death age)",,"SIB18AGO, SIB18AGD"
a3-ivp-p-1021,Error,A3,I - UDS Initial Visit (new participants),SIB19AGO,Plausibility,SIB19AGO cannot be > than SIB19AGD,"If Q2s6. SIB19AGO (Sibling 19 age of onset of primary dx) is in (0-110) and Q2s2. SIB19AGD (Sibling 19 death age) is in (0-110), then Q2s6. SIB19AGO (Sibling 19 age of onset of primary dx) must be <= Q2s2. SIB19AGD (Sibling 19 death age)",,"SIB19AGO, SIB19AGD"
a3-ivp-p-1022,Error,A3,I - UDS Initial Visit (new participants),SIB20AGO,Plausibility,SIB20AGO cannot be > than SIB20AGD,"If Q2t6. SIB20AGO (Sibling 20 age of onset of primary dx) is in (0-110) and Q2t2. SIB20AGD (Sibling 20 death age) is in (0-110), then Q2t6. SIB20AGO (Sibling 20 age of onset of primary dx) must be <= Q2t2. SIB20AGD (Sibling 20 death age)",,"SIB20AGO, SIB20AGD"
a3-ivp-p-1023,Error,A3,I - UDS Initial Visit (new participants),KID1AGO,Plausibility,KID1AGO cannot be > than KID1AGD,"If Q3a6. KID1AGO (Child 1 age of onset of primary dx) is in (0-110) and Q3a2. KID1AGD (Child 1 death age) is in (0-110), then Q3a6. KID1AGO (Child 1 age of onset of primary dx) must be <= Q3a2. KID1AGD (Child 1 death age)",,"KID1AGO, KID1AGD"
a3-ivp-p-1024,Error,A3,I - UDS Initial Visit (new participants),KID2AGO,Plausibility,KID2AGO cannot be > than KID2AGD,"If Q3b6. KID2AGO (Child 2 age of onset of primary dx) is in (0-110) and Q3b2. KID2AGD (Child 2 death age) is in (0-110), then Q3b6. KID2AGO (Child 2 age of onset of primary dx) must be <= Q3b2. KID2AGD (Child 2 death age)",,"KID2AGO, KID2AGD"
a3-ivp-p-1025,Error,A3,I - UDS Initial Visit (new participants),KID3AGO,Plausibility,KID3AGO cannot be > than KID3AGD,"If Q3c6. KID3AGO (Child 3 age of onset of primary dx) is in (0-110) and Q3c2. KID3AGD (Child 3 death age) is in (0-110), then Q3c6. KID3AGO (Child 3 age of onset of primary dx) must be <= Q3c2. KID3AGD (Child 3 death age)",,"KID3AGO, KID3AGD"
a3-ivp-p-1026,Error,A3,I - UDS Initial Visit (new participants),KID4AGO,Plausibility,KID4AGO cannot be > than KID4AGD,"If Q3d6. KID4AGO (Child 4 age of onset of primary dx) is in (0-110) and Q3d2. KID4AGD (Child 4 death age) is in (0-110), then Q3d6. KID4AGO (Child 4 age of onset of primary dx) must be <= Q3d2. KID4AGD (Child 4 death age)",,"KID4AGO, KID4AGD"
a3-ivp-p-1027,Error,A3,I - UDS Initial Visit (new participants),KID5AGO,Plausibility,KID5AGO cannot be > than KID5AGD,"If Q3e6. KID5AGO (Child 5 age of onset of primary dx) is in (0-110) and Q3e2. KID5AGD (Child 5 death age) is in (0-110), then Q3e6. KID5AGO (Child 5 age of onset of primary dx) must be <= Q3e2. KID5AGD (Child 5 death age)",,"KID5AGO, KID5AGD"
a3-ivp-p-1028,Error,A3,I - UDS Initial Visit (new participants),KID6AGO,Plausibility,KID6AGO cannot be > than KID6AGD,"If Q3f6. KID6AGO (Child 6 age of onset of primary dx) is in (0-110) and Q3f2. KID6AGD (Child 6 death age) is in (0-110), then Q3f6. KID6AGO (Child 6 age of onset of primary dx) must be <= Q3f2. KID6AGD (Child 6 death age)",,"KID6AGO, KID6AGD"
a3-ivp-p-1029,Error,A3,I - UDS Initial Visit (new participants),KID7AGO,Plausibility,KID7AGO cannot be > than KID7AGD,"If Q3g6. KID7AGO (Child 7 age of onset of primary dx) is in (0-110) and Q3g2. KID7AGD (Child 7 death age) is in (0-110), then Q3g6. KID7AGO (Child 7 age of onset of primary dx) must be <= Q3g2. KID7AGD (Child 7 death age)",,"KID7AGO, KID7AGD"
a3-ivp-p-1030,Error,A3,I - UDS Initial Visit (new participants),KID8AGO,Plausibility,KID8AGO cannot be > than KID8AGD,"If Q3h6. KID8AGO (Child 8 age of onset of primary dx) is in (0-110) and Q3h2. KID8AGD (Child 8 death age) is in (0-110), then Q3h6. KID8AGO (Child 8 age of onset of primary dx) must be <= Q3h2. KID8AGD (Child 8 death age)",,"KID8AGO, KID8AGD"
a3-ivp-p-1031,Error,A3,I - UDS Initial Visit (new participants),KID9AGO,Plausibility,KID9AGO cannot be > than KID9AGD,"If Q3i6. KID9AGO (Child 9 age of onset of primary dx) is in (0-110) and Q3i2. KID9AGD (Child 9 death age) is in (0-110), then Q3i6. KID9AGO (Child 9 age of onset of primary dx) must be <= Q3i2. KID9AGD (Child 9 death age)",,"KID9AGO, KID9AGD"
a3-ivp-p-1032,Error,A3,I - UDS Initial Visit (new participants),KID10AGO,Plausibility,KID10AGO cannot be > than KID10AGD,"If Q3j6. KID10AGO (Child 10 age of onset of primary dx) is in (0-110) and Q3j2. KID10AGD (Child 10 death age) is in (0-110), then Q3j6. KID10AGO (Child 10 age of onset of primary dx) must be <= Q3j2. KID10AGD (Child 10 death age)",,"KID10AGO, KID10AGD"
a3-ivp-p-1033,Error,A3,I - UDS Initial Visit (new participants),KID11AGO,Plausibility,KID11AGO cannot be > than KID11AGD,"If Q3k6. KID11AGO (Child 11 age of onset of primary dx) is in (0-110) and Q3k2. KID11AGD (Child 11 death age) is in (0-110), then Q3k6. KID11AGO (Child 11 age of onset of primary dx) must be <= Q3k2. KID11AGD (Child 11 death age)",,"KID11AGO, KID11AGD"
a3-ivp-p-1034,Error,A3,I - UDS Initial Visit (new participants),KID12AGO,Plausibility,KID12AGO cannot be > than KID12AGD,"If Q3l6. KID12AGO (Child 12 age of onset of primary dx) is in (0-110) and Q3l2. KID12AGD (Child 12 death age) is in (0-110), then Q3l6. KID12AGO (Child 12 age of onset of primary dx) must be <= Q3l2. KID12AGD (Child 12 death age)",,"KID12AGO, KID12AGD"
a3-ivp-p-1035,Error,A3,I - UDS Initial Visit (new participants),KID13AGO,Plausibility,KID13AGO cannot be > than KID13AGD,"If Q3m6. KID13AGO (Child 13 age of onset of primary dx) is in (0-110) and Q3m2. KID13AGD (Child 13 death age) is in (0-110), then Q3m6. KID13AGO (Child 13 age of onset of primary dx) must be <= Q3m2. KID13AGD (Child 13 death age)",,"KID13AGO, KID13AGD"
a3-ivp-p-1036,Error,A3,I - UDS Initial Visit (new participants),KID14AGO,Plausibility,KID14AGO cannot be > than KID14AGD,"If Q3n6. KID14AGO (Child 14 age of onset of primary dx) is in (0-110) and Q3n2. KID14AGD (Child 14 death age) is in (0-110), then Q3n6. KID14AGO (Child 14 age of onset of primary dx) must be <= Q3n2. KID14AGD (Child 14 death age)",,"KID14AGO, KID14AGD"
a3-ivp-p-1037,Error,A3,I - UDS Initial Visit (new participants),KID15AGO,Plausibility,KID15AGO cannot be > than KID15AGD,"If Q3o6. KID15AGO (Child 15 age of onset of primary dx) is in (0-110) and Q3o2. KID15AGD (Child 15 death age) is in (0-110), then Q3o6. KID15AGO (Child 15 age of onset of primary dx) must be <= Q3o2. KID15AGD (Child 15 death age)",,"KID15AGO, KID15AGD"
a3-i4vp-p-1001,Error,A3,I4 - UDS Initial Visit (existing participants),MOMAGEO,Plausibility,MOMAGEO cannot be > than MOMDAGE,Q1a6. MOMAGEO (Mom age of onset of primary dx) must be <= Q1a2. MOMDAGE (Mom death age),,"MOMAGEO, MOMDAGE"
a3-i4vp-p-1002,Error,A3,I4 - UDS Initial Visit (existing participants),DADAGEO,Plausibility,DADAGEO cannot be > than DADDAGE,Q1b6. DADAGEO (Dad age of onset of primary dx) must be <= Q1b2. DADDAGE (Dad death age),,"DADAGEO, DADDAGE"
a3-i4vp-p-1003,Error,A3,I4 - UDS Initial Visit (existing participants),SIB1AGO,Plausibility,SIB1AGO cannot be > than SIB1AGD,Q2a6. SIB1AGO (Sibling 1 age of onset of primary dx) must be <= Q2a2. SIB1AGD (Sibling 1 death age),,"SIB1AGO, SIB1AGD"
a3-i4vp-p-1004,Error,A3,I4 - UDS Initial Visit (existing participants),SIB2AGO,Plausibility,SIB2AGO cannot be > than SIB2AGD,Q2b6. SIB2AGO (Sibling 2 age of onset of primary dx) must be <= Q2b2. SIB2AGD (Sibling 2 death age),,"SIB2AGO, SIB2AGD"
a3-i4vp-p-1005,Error,A3,I4 - UDS Initial Visit (existing participants),SIB3AGO,Plausibility,SIB3AGO cannot be > than SIB3AGD,Q2c6. SIB3AGO (Sibling 3 age of onset of primary dx) must be <= Q2c2. SIB3AGD (Sibling 3 death age),,"SIB3AGO, SIB3AGD"
a3-i4vp-p-1006,Error,A3,I4 - UDS Initial Visit (existing participants),SIB4AGO,Plausibility,SIB4AGO cannot be > than SIB4AGD,Q2d6. SIB4AGO (Sibling 4 age of onset of primary dx) must be <= Q2d2. SIB4AGD (Sibling 4 death age),,"SIB4AGO, SIB4AGD"
a3-i4vp-p-1007,Error,A3,I4 - UDS Initial Visit (existing participants),SIB5AGO,Plausibility,SIB5AGO cannot be > than SIB5AGD,Q2e6. SIB5AGO (Sibling 5 age of onset of primary dx) must be <= Q2e2. SIB5AGD (Sibling 5 death age),,"SIB5AGO, SIB5AGD"
a3-i4vp-p-1008,Error,A3,I4 - UDS Initial Visit (existing participants),SIB6AGO,Plausibility,SIB6AGO cannot be > than SIB6AGD,Q2f6. SIB6AGO (Sibling 6 age of onset of primary dx) must be <= Q2f2. SIB6AGD (Sibling 6 death age),,"SIB6AGO, SIB6AGD"
a3-i4vp-p-1009,Error,A3,I4 - UDS Initial Visit (existing participants),SIB7AGO,Plausibility,SIB7AGO cannot be > than SIB7AGD,Q2g6. SIB7AGO (Sibling 7 age of onset of primary dx) must be <= Q2g2. SIB7AGD (Sibling 7 death age),,"SIB7AGO, SIB7AGD"
a3-i4vp-p-1010,Error,A3,I4 - UDS Initial Visit (existing participants),SIB8AGO,Plausibility,SIB8AGO cannot be > than SIB8AGD,Q2h6. SIB8AGO (Sibling 8 age of onset of primary dx) must be <= Q2h2. SIB8AGD (Sibling 8 death age),,"SIB8AGO, SIB8AGD"
a3-i4vp-p-1011,Error,A3,I4 - UDS Initial Visit (existing participants),SIB9AGO,Plausibility,SIB9AGO cannot be > than SIB9AGD,Q2i6. SIB9AGO (Sibling 9 age of onset of primary dx) must be <= Q2i2. SIB9AGD (Sibling 9 death age),,"SIB9AGO, SIB9AGD"
a3-i4vp-p-1012,Error,A3,I4 - UDS Initial Visit (existing participants),SIB10AGO,Plausibility,SIB10AGO cannot be > than SIB10AGD,Q2j6. SIB10AGO (Sibling 10 age of onset of primary dx) must be <= Q2j2. SIB10AGD (Sibling 10 death age),,"SIB10AGO, SIB10AGD"
a3-i4vp-p-1013,Error,A3,I4 - UDS Initial Visit (existing participants),SIB11AGO,Plausibility,SIB11AGO cannot be > than SIB11AGD,Q2k6. SIB11AGO (Sibling 11 age of onset of primary dx) must be <= Q2k2. SIB11AGD (Sibling 11 death age),,"SIB11AGO, SIB11AGD"
a3-i4vp-p-1014,Error,A3,I4 - UDS Initial Visit (existing participants),SIB12AGO,Plausibility,SIB12AGO cannot be > than SIB12AGD,Q2l6. SIB12AGO (Sibling 12 age of onset of primary dx) must be <= Q2l2. SIB12AGD (Sibling 12 death age),,"SIB12AGO, SIB12AGD"
a3-i4vp-p-1015,Error,A3,I4 - UDS Initial Visit (existing participants),SIB13AGO,Plausibility,SIB13AGO cannot be > than SIB13AGD,Q2m6. SIB13AGO (Sibling 13 age of onset of primary dx) must be <= Q2m2. SIB13AGD (Sibling 13 death age),,"SIB13AGO, SIB13AGD"
a3-i4vp-p-1016,Error,A3,I4 - UDS Initial Visit (existing participants),SIB14AGO,Plausibility,SIB14AGO cannot be > than SIB14AGD,Q2n6. SIB14AGO (Sibling 14 age of onset of primary dx) must be <= Q2n2. SIB14AGD (Sibling 14 death age),,"SIB14AGO, SIB14AGD"
a3-i4vp-p-1017,Error,A3,I4 - UDS Initial Visit (existing participants),SIB15AGO,Plausibility,SIB15AGO cannot be > than SIB15AGD,Q2o6. SIB15AGO (Sibling 15 age of onset of primary dx) must be <= Q2o2. SIB15AGD (Sibling 15 death age),,"SIB15AGO, SIB15AGD"
a3-i4vp-p-1018,Error,A3,I4 - UDS Initial Visit (existing participants),SIB16AGO,Plausibility,SIB16AGO cannot be > than SIB16AGD,Q2p6. SIB16AGO (Sibling 16 age of onset of primary dx) must be <= Q2p2. SIB16AGD (Sibling 16 death age),,"SIB16AGO, SIB16AGD"
a3-i4vp-p-1019,Error,A3,I4 - UDS Initial Visit (existing participants),SIB17AGO,Plausibility,SIB17AGO cannot be > than SIB17AGD,Q2q6. SIB17AGO (Sibling 17 age of onset of primary dx) must be <= Q2q2. SIB17AGD (Sibling 17 death age),,"SIB17AGO, SIB17AGD"
a3-i4vp-p-1020,Error,A3,I4 - UDS Initial Visit (existing participants),SIB18AGO,Plausibility,SIB18AGO cannot be > than SIB18AGD,Q2r6. SIB18AGO (Sibling 18 age of onset of primary dx) must be <= Q2r2. SIB18AGD (Sibling 18 death age),,"SIB18AGO, SIB18AGD"
a3-i4vp-p-1021,Error,A3,I4 - UDS Initial Visit (existing participants),SIB19AGO,Plausibility,SIB19AGO cannot be > than SIB19AGD,Q2s6. SIB19AGO (Sibling 19 age of onset of primary dx) must be <= Q2s2. SIB19AGD (Sibling 19 death age),,"SIB19AGO, SIB19AGD"
a3-i4vp-p-1022,Error,A3,I4 - UDS Initial Visit (existing participants),SIB20AGO,Plausibility,SIB20AGO cannot be > than SIB20AGD,Q2t6. SIB20AGO (Sibling 20 age of onset of primary dx) must be <= Q2t2. SIB20AGD (Sibling 20 death age),,"SIB20AGO, SIB20AGD"
a3-i4vp-p-1023,Error,A3,I4 - UDS Initial Visit (existing participants),KID1AGO,Plausibility,KID1AGO cannot be > than KID1AGD,Q3a6. KID1AGO (Child 1 age of onset of primary dx) must be <= Q3a2. KID1AGD (Child 1 death age),,"KID1AGO, KID1AGD"
a3-i4vp-p-1024,Error,A3,I4 - UDS Initial Visit (existing participants),KID2AGO,Plausibility,KID2AGO cannot be > than KID2AGD,Q3b6. KID2AGO (Child 2 age of onset of primary dx) must be <= Q3b2. KID2AGD (Child 2 death age),,"KID2AGO, KID2AGD"
a3-i4vp-p-1025,Error,A3,I4 - UDS Initial Visit (existing participants),KID3AGO,Plausibility,KID3AGO cannot be > than KID3AGD,Q3c6. KID3AGO (Child 3 age of onset of primary dx) must be <= Q3c2. KID3AGD (Child 3 death age),,"KID3AGO, KID3AGD"
a3-i4vp-p-1026,Error,A3,I4 - UDS Initial Visit (existing participants),KID4AGO,Plausibility,KID4AGO cannot be > than KID4AGD,Q3d6. KID4AGO (Child 4 age of onset of primary dx) must be <= Q3d2. KID4AGD (Child 4 death age),,"KID4AGO, KID4AGD"
a3-i4vp-p-1027,Error,A3,I4 - UDS Initial Visit (existing participants),KID5AGO,Plausibility,KID5AGO cannot be > than KID5AGD,Q3e6. KID5AGO (Child 5 age of onset of primary dx) must be <= Q3e2. KID5AGD (Child 5 death age),,"KID5AGO, KID5AGD"
a3-i4vp-p-1028,Error,A3,I4 - UDS Initial Visit (existing participants),KID6AGO,Plausibility,KID6AGO cannot be > than KID6AGD,Q3f6. KID6AGO (Child 6 age of onset of primary dx) must be <= Q3f2. KID6AGD (Child 6 death age),,"KID6AGO, KID6AGD"
a3-i4vp-p-1029,Error,A3,I4 - UDS Initial Visit (existing participants),KID7AGO,Plausibility,KID7AGO cannot be > than KID7AGD,Q3g6. KID7AGO (Child 7 age of onset of primary dx) must be <= Q3g2. KID7AGD (Child 7 death age),,"KID7AGO, KID7AGD"
a3-i4vp-p-1030,Error,A3,I4 - UDS Initial Visit (existing participants),KID8AGO,Plausibility,KID8AGO cannot be > than KID8AGD,Q3h6. KID8AGO (Child 8 age of onset of primary dx) must be <= Q3h2. KID8AGD (Child 8 death age),,"KID8AGO, KID8AGD"
a3-i4vp-p-1031,Error,A3,I4 - UDS Initial Visit (existing participants),KID9AGO,Plausibility,KID9AGO cannot be > than KID9AGD,Q3i6. KID9AGO (Child 9 age of onset of primary dx) must be <= Q3i2. KID9AGD (Child 9 death age),,"KID9AGO, KID9AGD"
a3-i4vp-p-1032,Error,A3,I4 - UDS Initial Visit (existing participants),KID10AGO,Plausibility,KID10AGO cannot be > than KID10AGD,Q3j6. KID10AGO (Child 10 age of onset of primary dx) must be <= Q3j2. KID10AGD (Child 10 death age),,"KID10AGO, KID10AGD"
a3-i4vp-p-1033,Error,A3,I4 - UDS Initial Visit (existing participants),KID11AGO,Plausibility,KID11AGO cannot be > than KID11AGD,Q3k6. KID11AGO (Child 11 age of onset of primary dx) must be <= Q3k2. KID11AGD (Child 11 death age),,"KID11AGO, KID11AGD"
a3-i4vp-p-1034,Error,A3,I4 - UDS Initial Visit (existing participants),KID12AGO,Plausibility,KID12AGO cannot be > than KID12AGD,Q3l6. KID12AGO (Child 12 age of onset of primary dx) must be <= Q3l2. KID12AGD (Child 12 death age),,"KID12AGO, KID12AGD"
a3-i4vp-p-1035,Error,A3,I4 - UDS Initial Visit (existing participants),KID13AGO,Plausibility,KID13AGO cannot be > than KID13AGD,Q3m6. KID13AGO (Child 13 age of onset of primary dx) must be <= Q3m2. KID13AGD (Child 13 death age),,"KID13AGO, KID13AGD"
a3-i4vp-p-1036,Error,A3,I4 - UDS Initial Visit (existing participants),KID14AGO,Plausibility,KID14AGO cannot be > than KID14AGD,Q3n6. KID14AGO (Child 14 age of onset of primary dx) must be <= Q3n2. KID14AGD (Child 14 death age),,"KID14AGO, KID14AGD"
a3-i4vp-p-1037,Error,A3,I4 - UDS Initial Visit (existing participants),KID15AGO,Plausibility,KID15AGO cannot be > than KID15AGD,Q3o6. KID15AGO (Child 15 age of onset of primary dx) must be <= Q3o2. KID15AGD (Child 15 death age),,"KID15AGO, KID15AGD"
a3-i4vp-p-1038,Alert,A3,I4 - UDS Initial Visit (existing participants),MOMYOB,Plausibility,MOMYOB should be the same as UDSv3,"If UDSv4 Q1a1. MOMYOB (Mom birth year) is not equal to 9999 (Unknown) and UDSv3 Q5a2. MOMYOB (Mom birth year) is not equal to 9999 (Unknown), then UDSv4 Q1a1. MOMYOB (Mom birth year) should be equal to UDSv3 Q5a2. MOMYOB (Mom birth year) at the previous visit where UDSv3 MOMYOB is not blank","a3, a3[UDSv3]",
a3-i4vp-p-1039,Alert,A3,I4 - UDS Initial Visit (existing participants),MOMDAGE,Plausibility,MOMDAGE should be the same as UDSv3,"If UDSv4 Q1a2. MOMDAGE (Mom death age) is not equal to 888 or 999 (Not applicable or Unknown) and UDSv3 Q5a3. MOMDAGE (Mom death age) is not equal to 888 or 999 (Not applicable or Unknown), then UDSv4 Q1a2. MOMDAGE (Mom death age) should be equal to UDSv3 Q5a3. MOMDAGE (Mom death age) at the previous visit where MOMDAGE is not blank","a3, a3[UDSv3]",
